Rule ID,Resource ID,Compliance,Exception Reason,Rule Level,Rule Info
"AwsSolutions-COG1","Default/Defaults/UserPool/Resource","Non-Compliant","N/A","Error","The Cognito user pool does not have a password policy that minimally specify a password length of at least 8 characters, as well as requiring uppercase, numeric, and special characters."
"AwsSolutions-COG2","Default/Defaults/UserPool/Resource","Non-Compliant","N/A","Warning","The Cognito user pool does not require MFA."
"AwsSolutions-COG3","Default/Defaults/UserPool/Resource","Non-Compliant","N/A","Error","The Cognito user pool does not have AdvancedSecurityMode set to ENFORCED."
"AwsSolutions-COG7","Default/Defaults/IdentityPool/Resource","Compliant","N/A","Error","The Cognito identity pool allows for unauthenticated logins and does not have a cdk-nag rule suppression with a reason."
"AwsSolutions-IAM4","Default/Defaults/IdentityPool/AuthenticatedRole/Resource","Compliant","N/A","Error","The IAM user, role, or group uses AWS managed policies."
"AwsSolutions-IAM5","Default/Defaults/IdentityPool/AuthenticatedRole/Resource","Compliant","N/A","Error","The IAM entity contains wildcard permissions and does not have a cdk-nag rule suppression with evidence for those permission."
"AwsSolutions-IAM4","Default/Defaults/IdentityPool/UnauthenticatedRole/Resource","Compliant","N/A","Error","The IAM user, role, or group uses AWS managed policies."
"AwsSolutions-IAM5","Default/Defaults/IdentityPool/UnauthenticatedRole/Resource","Compliant","N/A","Error","The IAM entity contains wildcard permissions and does not have a cdk-nag rule suppression with evidence for those permission."
